{
  "$schema": "https://json-schema.org/draft/2020-12/schema",
  "$id": "quiz-contract/v1/draft-quiz",
  "title": "Private canonical quiz draft",
  "type": "object",
  "additionalProperties": false,
  "required": ["contract", "state", "quiz_id", "revision", "locale", "questions"],
  "properties": {
    "contract": {"const": "quiz-contract/v1"},
    "state": {"const": "draft"},
    "quiz_id": {"$ref": "#/$defs/id"},
    "revision": {"$ref": "#/$defs/revision"},
    "locale": {"type": "string", "minLength": 2}, "taxonomy_ref": {"$ref": "#/$defs/taxonomyRef"},
    "questions": {"type": "array", "minItems": 1, "items": {"$ref": "#/$defs/question"}}
  },
  "$defs": {
    "id": {"type": "string", "pattern": "^[a-z][a-z0-9-]{2,63}$"}, "tagID": {"type": "string", "pattern": "^[a-z][a-z0-9-]*:[a-z][a-z0-9-]*$"}, "hash": {"type": "string", "pattern": "^[0-9a-f]{64}$"}, "taxonomyRef": {"type": "object", "additionalProperties": false, "required": ["taxonomy_id", "taxonomy_sha256"], "properties": {"taxonomy_id": {"type": "string", "minLength": 1}, "taxonomy_sha256": {"$ref": "#/$defs/hash"}}},
    "revision": {"type": "object", "additionalProperties": false, "required": ["number", "sha256"], "properties": {"number": {"type": "integer", "minimum": 1}, "sha256": {"type": "string", "pattern": "^[0-9a-f]{64}$"}}},
    "option": {"type": "object", "additionalProperties": false, "required": ["option_id", "text"], "properties": {"option_id": {"$ref": "#/$defs/id"}, "text": {"type": "string", "minLength": 1}, "media": {"$ref": "#/$defs/media"}}},
    "source": {"type": "object", "additionalProperties": false, "required": ["uri"], "properties": {"uri": {"type": "string", "minLength": 1}, "title": {"type": "string"}}},
    "media": {"type": "object", "additionalProperties": false, "required": ["uri"], "properties": {"uri": {"type": "string", "minLength": 1}, "kind": {"type": "string"}, "alt": {"type": "string"}}},
    "grading": {"oneOf": [
      {"type": "object", "additionalProperties": false, "required": ["correct_option_id"], "properties": {"correct_option_id": {"$ref": "#/$defs/id"}}},
      {"type": "object", "additionalProperties": false, "required": ["correct_option_ids"], "properties": {"correct_option_ids": {"type": "array", "minItems": 1, "items": {"$ref": "#/$defs/id"}}}},
      {"type": "object", "additionalProperties": false, "required": ["accepted_variants"], "properties": {"accepted_variants": {"type": "array", "minItems": 1, "items": {"type": "string", "minLength": 1}}}}
    ]},
    "question": {"type": "object", "additionalProperties": false, "required": ["question_id", "revision", "stem", "options", "difficulty", "source", "answer_kind", "grading"], "properties": {"question_id": {"$ref": "#/$defs/id"}, "revision": {"$ref": "#/$defs/revision"}, "stem": {"type": "string", "minLength": 1}, "options": {"type": "array", "minItems": 4, "maxItems": 6, "items": {"$ref": "#/$defs/option"}}, "difficulty": {"enum": ["unknown", "easy", "medium", "hard", "nightmare"]}, "difficulty_level": {"type": "integer", "minimum": 1, "maximum": 10}, "editorial_tag_ids": {"type": "array", "items": {"$ref": "#/$defs/tagID"}}, "context_tag_ids": {"type": "array", "items": {"$ref": "#/$defs/tagID"}}, "source": {"$ref": "#/$defs/source"}, "media": {"type": "array", "items": {"$ref": "#/$defs/media"}}, "answer_kind": {"enum": ["single_choice", "multiple_choice", "normalized_text"]}, "grading": {"$ref": "#/$defs/grading"}}}
  }
}
