{
  "contract": "quiz-contract/v1",
  "state": "draft",
  "quiz_id": "animation-studios-pixar-dreamworks",
  "revision": {
    "number": 1,
    "sha256": "6e2961dc96dc86c03077b5c189252781a19c34cc62332c760e3a5682a28bccc4"
  },
  "locale": "ru",
  "questions": [
    {
      "question_id": "theme-pixar-001",
      "revision": {
        "number": 1,
        "sha256": "afbe708518dcd2ad6aa479b930f0b20cf186c12e331d4d905116b0e06d5100f7"
      },
      "stem": "В «Истории игрушек» какую роль Базз Лайтер считает своей настоящей службой?",
      "options": [
        {
          "option_id": "theme-pixar-001-opt-1",
          "text": "Капитана космического корабля"
        },
        {
          "option_id": "theme-pixar-001-opt-2",
          "text": "Космического рейнджера"
        },
        {
          "option_id": "theme-pixar-001-opt-3",
          "text": "Командира игрушечного поезда"
        },
        {
          "option_id": "theme-pixar-001-opt-4",
          "text": "Смотрителя детской комнаты"
        }
      ],
      "difficulty": "unknown",
      "source": {
        "uri": "/app/quizzes/Collections/animation-studios-pixar-dreamworks.json"
      },
      "answer_kind": "single_choice",
      "grading": {
        "correct_option_id": "theme-pixar-001-opt-2"
      }
    },
    {
      "question_id": "theme-pixar-002",
      "revision": {
        "number": 1,
        "sha256": "83fccb90c45589ed717a7c2e4808daa8fdb8ab07e1cc9ef94e9485f1b3358c9f"
      },
      "stem": "Почему Базз в «Истории игрушек» принимает Pizza Planet за возможный путь домой?",
      "options": [
        {
          "option_id": "theme-pixar-002-opt-1",
          "text": "Это мастерская по ремонту игрушек"
        },
        {
          "option_id": "theme-pixar-002-opt-2",
          "text": "Это аэропорт рядом с домом Энди"
        },
        {
          "option_id": "theme-pixar-002-opt-3",
          "text": "Это космически оформленный драйв-ин"
        },
        {
          "option_id": "theme-pixar-002-opt-4",
          "text": "Это склад посылок Star Command"
        }
      ],
      "difficulty": "unknown",
      "source": {
        "uri": "/app/quizzes/Collections/animation-studios-pixar-dreamworks.json"
      },
      "answer_kind": "single_choice",
      "grading": {
        "correct_option_id": "theme-pixar-002-opt-3"
      }
    },
    {
      "question_id": "theme-pixar-003",
      "revision": {
        "number": 1,
        "sha256": "9ced582055e3a1b0edf477e24f5018cafabacb82ac1ef69413560981a89dc7ea"
      },
      "stem": "Кем Немо приходится Марлину в «В поисках Немо»?",
      "options": [
        {
          "option_id": "theme-pixar-003-opt-1",
          "text": "Сыном"
        },
        {
          "option_id": "theme-pixar-003-opt-2",
          "text": "Младшим братом"
        },
        {
          "option_id": "theme-pixar-003-opt-3",
          "text": "Учеником"
        },
        {
          "option_id": "theme-pixar-003-opt-4",
          "text": "Соседом по анемоне"
        }
      ],
      "difficulty": "unknown",
      "source": {
        "uri": "/app/quizzes/Collections/animation-studios-pixar-dreamworks.json"
      },
      "answer_kind": "single_choice",
      "grading": {
        "correct_option_id": "theme-pixar-003-opt-1"
      }
    },
    {
      "question_id": "theme-pixar-004",
      "revision": {
        "number": 1,
        "sha256": "a89e0055f8f47ab26360ade87102245b564c631ad6ca9154b403d2907a90fbf9"
      },
      "stem": "Какая особенность памяти Дори определяет её помощь Марлину в «В поисках Немо»?",
      "options": [
        {
          "option_id": "theme-pixar-004-opt-1",
          "text": "Избирательной памятью на маршруты"
        },
        {
          "option_id": "theme-pixar-004-opt-2",
          "text": "Потерей воспоминаний о детстве"
        },
        {
          "option_id": "theme-pixar-004-opt-3",
          "text": "Памятью только на опасности"
        },
        {
          "option_id": "theme-pixar-004-opt-4",
          "text": "Потерей кратковременной памяти"
        }
      ],
      "difficulty": "unknown",
      "source": {
        "uri": "/app/quizzes/Collections/animation-studios-pixar-dreamworks.json"
      },
      "answer_kind": "single_choice",
      "grading": {
        "correct_option_id": "theme-pixar-004-opt-4"
      }
    },
    {
      "question_id": "theme-pixar-005",
      "revision": {
        "number": 1,
        "sha256": "5b71504e1e7ba3a98b40ec7c4f1d6c0bba5c8f01063dada5380e81dd6f2c497e"
      },
      "stem": "Какую роль Жабр выполняет среди рыб в аквариуме стоматолога в «В поисках Немо»?",
      "options": [
        {
          "option_id": "theme-pixar-005-opt-1",
          "text": "Составляет план кормления"
        },
        {
          "option_id": "theme-pixar-005-opt-2",
          "text": "Возглавляет группу рыб"
        },
        {
          "option_id": "theme-pixar-005-opt-3",
          "text": "Следит за чистотой аквариума"
        },
        {
          "option_id": "theme-pixar-005-opt-4",
          "text": "Выбирает новых обитателей"
        }
      ],
      "difficulty": "unknown",
      "source": {
        "uri": "/app/quizzes/Collections/animation-studios-pixar-dreamworks.json"
      },
      "answer_kind": "single_choice",
      "grading": {
        "correct_option_id": "theme-pixar-005-opt-2"
      }
    },
    {
      "question_id": "theme-pixar-006",
      "revision": {
        "number": 1,
        "sha256": "1df283c67ccd428272af4af755f3e0b95465be4707f5ef02015e4d6f41578e71"
      },
      "stem": "Чем является штаб-квартира в сознании Райли в «Головоломке»?",
      "options": [
        {
          "option_id": "theme-pixar-006-opt-1",
          "text": "Центром хранения воспоминаний"
        },
        {
          "option_id": "theme-pixar-006-opt-2",
          "text": "Центром создания снов"
        },
        {
          "option_id": "theme-pixar-006-opt-3",
          "text": "Центром управления эмоциями Райли"
        },
        {
          "option_id": "theme-pixar-006-opt-4",
          "text": "Центром воображаемых игр"
        }
      ],
      "difficulty": "unknown",
      "source": {
        "uri": "/app/quizzes/Collections/animation-studios-pixar-dreamworks.json"
      },
      "answer_kind": "single_choice",
      "grading": {
        "correct_option_id": "theme-pixar-006-opt-3"
      }
    },
    {
      "question_id": "theme-pixar-007",
      "revision": {
        "number": 1,
        "sha256": "57d8d8c04d274b164a7542c0764c525ecbcb148a4f0af342cc7bc48468583713"
      },
      "stem": "За что прежде всего отвечает Страх в «Головоломке»?",
      "options": [
        {
          "option_id": "theme-pixar-007-opt-1",
          "text": "За безопасность и оценку опасностей"
        },
        {
          "option_id": "theme-pixar-007-opt-2",
          "text": "За отвращение к неприятному"
        },
        {
          "option_id": "theme-pixar-007-opt-3",
          "text": "За вспышки гнева"
        },
        {
          "option_id": "theme-pixar-007-opt-4",
          "text": "За грусть от потери"
        }
      ],
      "difficulty": "unknown",
      "source": {
        "uri": "/app/quizzes/Collections/animation-studios-pixar-dreamworks.json"
      },
      "answer_kind": "single_choice",
      "grading": {
        "correct_option_id": "theme-pixar-007-opt-1"
      }
    },
    {
      "question_id": "theme-pixar-008",
      "revision": {
        "number": 1,
        "sha256": "6eb5496f44a1fa4ca3a9efa0758da4b205d41cdac383667c7aa231ec004d26e9"
      },
      "stem": "Как Pixar описывает внешность Бинго-Бонго в «Головоломке»?",
      "options": [
        {
          "option_id": "theme-pixar-008-opt-1",
          "text": "Уши кролика, лапы тигра и мех из облаков"
        },
        {
          "option_id": "theme-pixar-008-opt-2",
          "text": "Клюв утки, крылья бабочки и тело из стекла"
        },
        {
          "option_id": "theme-pixar-008-opt-3",
          "text": "Рога оленя, хвост лисы и шерсть из травы"
        },
        {
          "option_id": "theme-pixar-008-opt-4",
          "text": "Хобот слона, хвост кота и тело из сахарной ваты"
        }
      ],
      "difficulty": "unknown",
      "source": {
        "uri": "/app/quizzes/Collections/animation-studios-pixar-dreamworks.json"
      },
      "answer_kind": "single_choice",
      "grading": {
        "correct_option_id": "theme-pixar-008-opt-4"
      }
    },
    {
      "question_id": "theme-pixar-009",
      "revision": {
        "number": 1,
        "sha256": "8aad60cc4cd6054b5db2c4c9c9003ab395b5827b27c9460d6bc02efd96e331d4"
      },
      "stem": "Кем Пепита служит Маме Имельде в «Тайне Коко»?",
      "options": [
        {
          "option_id": "theme-pixar-009-opt-1",
          "text": "Учительницей музыки"
        },
        {
          "option_id": "theme-pixar-009-opt-2",
          "text": "Духовным проводником-алебрихе"
        },
        {
          "option_id": "theme-pixar-009-opt-3",
          "text": "Хранительницей семейного архива"
        },
        {
          "option_id": "theme-pixar-009-opt-4",
          "text": "Начальницей таможни мира мёртвых"
        }
      ],
      "difficulty": "unknown",
      "source": {
        "uri": "/app/quizzes/Collections/animation-studios-pixar-dreamworks.json"
      },
      "answer_kind": "single_choice",
      "grading": {
        "correct_option_id": "theme-pixar-009-opt-2"
      }
    },
    {
      "question_id": "theme-pixar-010",
      "revision": {
        "number": 1,
        "sha256": "3e7d34f2be3d26654b990115f9e32015d44e920e7d5919d81fc23ca35ceb5795"
      },
      "stem": "Кем мечтает стать Реми в «Рататуе»?",
      "options": [
        {
          "option_id": "theme-pixar-010-opt-1",
          "text": "Ресторанным критиком"
        },
        {
          "option_id": "theme-pixar-010-opt-2",
          "text": "Поставщиком продуктов"
        },
        {